{
  "$schema": "../schemas/mock-blueprint.schema.json",
  "schemaVersion": 1,
  "id": "ctet-paper-1",
  "exam": "ctet",
  "paper": 1,
  "durationMinutes": 150,
  "totalQuestions": 150,
  "totalMarks": 150,
  "negativeMarking": 0,
  "languageRules": {
    "slots": 2,
    "mustDiffer": true,
    "supportedLanguages": ["hi", "en", "sa"]
  },
  "sections": [
    {"id": "cdp", "section": "cdp", "languageSlot": null, "stream": null, "questionCount": 30, "marks": 30, "contentMode": "bilingual", "selectionPolicy": "smart-weighted"},
    {"id": "language-1", "section": "language", "languageSlot": 1, "stream": null, "questionCount": 30, "marks": 30, "contentMode": "language-specific", "selectionPolicy": "smart-weighted"},
    {"id": "language-2", "section": "language", "languageSlot": 2, "stream": null, "questionCount": 30, "marks": 30, "contentMode": "language-specific", "selectionPolicy": "smart-weighted"},
    {"id": "mathematics", "section": "mathematics", "languageSlot": null, "stream": null, "questionCount": 30, "marks": 30, "contentMode": "bilingual", "selectionPolicy": "smart-weighted"},
    {"id": "environmental-studies", "section": "environmental-studies", "languageSlot": null, "stream": null, "questionCount": 30, "marks": 30, "contentMode": "bilingual", "selectionPolicy": "smart-weighted"}
  ],
  "constraints": {
    "stimulusGroupsAtomic": true,
    "excludeSemanticDuplicates": true,
    "respectTopicQuotas": true,
    "respectExposureLimits": true
  }
}
